duplicate_title,duplicate_db,original_title,original_db,reason
Continuous thermographic observation may predict extravasation in chemotherapy-treated patients.,CINAHL,Continuous thermographic observation may predict extravasation in chemotherapy-treated patients.,PubMed,DOI match: 10.1016/j.ejon.2017.02.009
Ultrasonographic Detection of Micro-Bubbles in the Right Atrium to Confirm Peripheral Venous Catheter Position in Children.,CINAHL,Ultrasonographic Detection of Micro-Bubbles in the Right Atrium to Confirm Peripheral Venous Catheter Position in Children.,PubMed,DOI match: 10.1097/ccm.0000000000003916
273 Contrast Extravasation Prevalence in Emergency Department Patients With Ultrasound-Guided Peripheral Intravenous Catheters.,CINAHL,Contrast extravasation prevalence in emergency department patients with ultrasound-guided peripheral intravenous catheters,Embase,Title similarity (0.92): '273 Contrast Extravasation Prevalence in Emergency Departmen...'
Ultrasonographically guided insertion of a 15-cm catheter into the deep brachial or basilic vein in patients with difficult intravenous access.,CINAHL,Ultrasonographically guided insertion of a 15-cm catheter into the deep brachial or basilic vein in patients with difficult intravenous access.,PubMed,Title similarity (1.00): 'Ultrasonographically guided insertion of a 15-cm catheter in...'
Confirming extravasation from a peripheral venous catheter: another role for ultrasonography.,CINAHL,Confirming extravasation from a peripheral venous catheter: another role for ultrasonography.,PubMed,DOI match: 10.1111/j.1365-2044.2012.07092.x
Central vein dilatation prior to concomitant port implantation.,CINAHL,Central vein dilatation prior to concomitant port implantation.,PubMed,DOI match: 10.1007/s00270-009-9699-z
The Midline Catheter: A Clinical Review.,CINAHL,The Midline Catheter: A Clinical Review.,PubMed,DOI match: 10.1016/j.jemermed.2016.05.029
Evaluation of a thermosensitive liquid crystal film for catheterization site assessment immediately following chemotherapy administration: An observational study.,CINAHL,Evaluation of a thermosensitive liquid crystal film for catheterization site assessment immediately following chemotherapy administration: An observational study.,PubMed,DOI match: 10.1016/j.ejon.2020.101802
